{
  "all_reasons": [
    "OK"
  ],
  "case_id": "R0::B04-SOFTWARE::CLEAN",
  "checks": {
    "algorithm_policy": "PASS",
    "attestation_structure": "PASS",
    "bounded_input": "PASS",
    "certificate_time": "PASS",
    "closed_world_inventory": "PASS",
    "manifest_canonicality": "PASS",
    "manifest_json_syntax": "PASS",
    "manifest_schema": "PASS",
    "path_safety": "PASS",
    "payload_digests": "PASS",
    "provenance_policy": "PASS",
    "signature_crypto": "PASS",
    "signer_policy": "PASS",
    "subject_binding": "PASS",
    "transparency": "PASS"
  },
  "decision": "ACCEPT",
  "details": {},
  "ended_at": "2026-07-13T06:49:39.396579Z",
  "implementation": {
    "dirty": true,
    "git_commit": "40663854cfc2a2cf8e8e828cc0ac7c031db58963",
    "source_archive_sha256": "c2230f22030989d9a144fb17a3db5901dda0ffa40230b0dc6c9e04264502941a",
    "version": "0.4.0.dev0"
  },
  "input": {
    "attestation_sha256": "1fa8f5a251b243fa8be4af11ea93ce583eaf8263209edcb2e9f4815da3cf6296",
    "case_archive_sha256": "9f4a783674496b0b63a86b9f9ae877a0f88e82f1c6191a0982cfa9212806fbd6",
    "manifest_sha256": "d7acb68a463375ee41ac1ca53f1202d05faf58b0ef7e8b7bd4954de8d00fdb6e",
    "trust_policy_sha256": "f796d190478caa4fa52dfaf671704bacf87a6bdbf456dae91025984c117bd4d5"
  },
  "primary_reason": "OK",
  "profile_id": "P3",
  "schema_version": "0.3.0-draft",
  "started_at": "2026-07-13T06:49:39.395167Z"
}
