{
  "all_reasons": [
    "OK"
  ],
  "case_id": "R0::B03-MODEL::CLEAN",
  "checks": {
    "algorithm_policy": "NOT_REQUIRED",
    "attestation_structure": "NOT_REQUIRED",
    "bounded_input": "PASS",
    "certificate_time": "NOT_REQUIRED",
    "closed_world_inventory": "NOT_REQUIRED",
    "manifest_canonicality": "NOT_REQUIRED",
    "manifest_json_syntax": "PASS",
    "manifest_schema": "NOT_REQUIRED",
    "path_safety": "NOT_REQUIRED",
    "payload_digests": "NOT_REQUIRED",
    "provenance_policy": "NOT_REQUIRED",
    "signature_crypto": "NOT_REQUIRED",
    "signer_policy": "NOT_REQUIRED",
    "subject_binding": "NOT_REQUIRED",
    "transparency": "NOT_REQUIRED"
  },
  "decision": "ACCEPT",
  "details": {},
  "ended_at": "2026-07-13T06:49:39.381011Z",
  "implementation": {
    "dirty": true,
    "git_commit": "40663854cfc2a2cf8e8e828cc0ac7c031db58963",
    "source_archive_sha256": "c2230f22030989d9a144fb17a3db5901dda0ffa40230b0dc6c9e04264502941a",
    "version": "0.4.0.dev0"
  },
  "input": {
    "attestation_sha256": null,
    "case_archive_sha256": "58c29605301030fd848fe87ffae017e0658b8035e7cd664092e5b355b5ef226f",
    "manifest_sha256": "4fa116958c84158d0d1724eadc62c0d1daee1fc9d7901bc5c2695b6fb5279f3b",
    "trust_policy_sha256": "f796d190478caa4fa52dfaf671704bacf87a6bdbf456dae91025984c117bd4d5"
  },
  "primary_reason": "OK",
  "profile_id": "P0",
  "schema_version": "0.3.0-draft",
  "started_at": "2026-07-13T06:49:39.380715Z"
}
