{
  "all_reasons": [
    "OK"
  ],
  "case_id": "R0::B01-TABULAR::CLEAN",
  "checks": {
    "algorithm_policy": "NOT_REQUIRED",
    "attestation_structure": "NOT_REQUIRED",
    "bounded_input": "PASS",
    "certificate_time": "NOT_REQUIRED",
    "closed_world_inventory": "PASS",
    "manifest_canonicality": "PASS",
    "manifest_json_syntax": "PASS",
    "manifest_schema": "PASS",
    "path_safety": "PASS",
    "payload_digests": "PASS",
    "provenance_policy": "NOT_REQUIRED",
    "signature_crypto": "NOT_REQUIRED",
    "signer_policy": "NOT_REQUIRED",
    "subject_binding": "NOT_REQUIRED",
    "transparency": "NOT_REQUIRED"
  },
  "decision": "ACCEPT",
  "details": {},
  "ended_at": "2026-07-13T06:49:39.200054Z",
  "implementation": {
    "dirty": true,
    "git_commit": "40663854cfc2a2cf8e8e828cc0ac7c031db58963",
    "source_archive_sha256": "c2230f22030989d9a144fb17a3db5901dda0ffa40230b0dc6c9e04264502941a",
    "version": "0.4.0.dev0"
  },
  "input": {
    "attestation_sha256": null,
    "case_archive_sha256": "bbd52fce2bb280e474952912115beae107b3be363b1dd51314531273bc041a03",
    "manifest_sha256": "5d1274581e6c35783536308f66f034a641cc7097200d425253801a4f509f9b66",
    "trust_policy_sha256": "f796d190478caa4fa52dfaf671704bacf87a6bdbf456dae91025984c117bd4d5"
  },
  "primary_reason": "OK",
  "profile_id": "P1",
  "schema_version": "0.3.0-draft",
  "started_at": "2026-07-13T06:49:39.199182Z"
}
