{
  "all_reasons": [
    "OK"
  ],
  "case_id": "R0::B02-PAPER::CLEAN",
  "checks": {
    "algorithm_policy": "PASS",
    "attestation_structure": "PASS",
    "bounded_input": "PASS",
    "certificate_time": "PASS",
    "closed_world_inventory": "NOT_REQUIRED",
    "manifest_canonicality": "NOT_REQUIRED",
    "manifest_json_syntax": "NOT_REQUIRED",
    "manifest_schema": "NOT_REQUIRED",
    "path_safety": "NOT_REQUIRED",
    "payload_digests": "NOT_REQUIRED",
    "provenance_policy": "NOT_REQUIRED",
    "signature_crypto": "PASS",
    "signer_policy": "PASS",
    "subject_binding": "PASS",
    "transparency": "PASS"
  },
  "decision": "ACCEPT",
  "details": {},
  "ended_at": "2026-07-13T06:49:39.235111Z",
  "implementation": {
    "dirty": true,
    "git_commit": "40663854cfc2a2cf8e8e828cc0ac7c031db58963",
    "source_archive_sha256": "c2230f22030989d9a144fb17a3db5901dda0ffa40230b0dc6c9e04264502941a",
    "version": "0.4.0.dev0"
  },
  "input": {
    "attestation_sha256": "28f1a4cdcbbd87a0aad0620a1bc7b01bf3eeaeffea4dbd51aa6be4f101e0c7b8",
    "case_archive_sha256": "dfe0092122866e1e77c58dd8a5877f13f011786eeea73aa1bf3a4a478e9b44bf",
    "manifest_sha256": "b8e1bc023f2ef67dc91c1adc303ed8eb884f4fc7f24baf1460a65f5e663f34ad",
    "trust_policy_sha256": "f796d190478caa4fa52dfaf671704bacf87a6bdbf456dae91025984c117bd4d5"
  },
  "primary_reason": "OK",
  "profile_id": "P2",
  "schema_version": "0.3.0-draft",
  "started_at": "2026-07-13T06:49:39.231826Z"
}
