{
  "all_reasons": [
    "OK"
  ],
  "case_id": "R0-B03-MODEL-CLEAN",
  "checks": {
    "algorithm_policy": "PASS",
    "attestation_structure": "PASS",
    "bounded_input": "PASS",
    "certificate_time": "PASS",
    "closed_world_inventory": "NOT_REQUIRED",
    "manifest_canonicality": "NOT_REQUIRED",
    "manifest_json_syntax": "NOT_REQUIRED",
    "manifest_schema": "NOT_REQUIRED",
    "path_safety": "NOT_REQUIRED",
    "payload_digests": "NOT_REQUIRED",
    "provenance_policy": "NOT_REQUIRED",
    "signature_crypto": "PASS",
    "signer_policy": "PASS",
    "subject_binding": "PASS",
    "transparency": "PASS"
  },
  "decision": "ACCEPT",
  "details": {},
  "ended_at": "2026-07-13T06:52:34.394759Z",
  "implementation": {
    "dirty": true,
    "git_commit": "40663854cfc2a2cf8e8e828cc0ac7c031db58963",
    "source_archive_sha256": "1477628425ab6ecd171f46d70b9a1725e72aa270fca680b22baf368469f6a861",
    "version": "0.4.0.dev0"
  },
  "input": {
    "attestation_sha256": "ab9499f97f46433adc8ec90a07d1e514b3f54d1127f55eaeb15aa72ccdde02d9",
    "case_archive_sha256": "58c29605301030fd848fe87ffae017e0658b8035e7cd664092e5b355b5ef226f",
    "manifest_sha256": "4fa116958c84158d0d1724eadc62c0d1daee1fc9d7901bc5c2695b6fb5279f3b",
    "trust_policy_sha256": "f796d190478caa4fa52dfaf671704bacf87a6bdbf456dae91025984c117bd4d5"
  },
  "primary_reason": "OK",
  "profile_id": "P2",
  "schema_version": "0.3.0-draft",
  "started_at": "2026-07-13T06:52:34.393379Z"
}
